{
    "$schema": "http://json-schema.org/draft-04/schema#",
    "id": "https://asclepias.org/schema/event-v1.0.json",
    "title": "Event message schema.",
    "description": "Schema of the event message.",
    "additionalProperties": false,
    "type": "object",
    "properties": {
        "event_type": {
            "type": "string",
            "description": "Type of the event. Controlled vocabulary: 'relation_created' or 'relation_deleted'",
            "enum": ["relation_created", "relation_deleted"]

        },
        "creator": {
            "type": "string",
            "description": "High-level name of the part which emmited this event."
        },
        "source": {
            "type": "string",
            "description": "Name of the source, algorithm or procedure, which created this event."
        },
        "payload": {
            "type": "array",
            "description": "Payload information specific to the event_type. An array, containing one or more payloads of the structure matching with the event_type.",
            "items": {
                "anyOf": [
                    {
                        "$ref": "https://asclepias.org/schema/relation-v1.0.json"
                    }
                ]
            }
        },
        "id": {
            "type": "string",
            "description": "Globally unique identifier of the event (UUID version 4 as specified in RFC 4122)."
        },
        "time": {
            "type": "string",
            "description": "Time when the payload information was created."
        }
    },
    "required": [
      "event_type",
      "creator",
      "source",
      "payload",
      "id",
      "time"
    ]
}
