{
    "event_type": "relation_deleted",
    "creator": "Zenodo",
    "id": "03e942d7-966d-4f11-9181-f2f1bde1f002",
    "source": "Zenodo",
    "time": "1507843778.39",
    "payload": [
        {
            "relationship_type": {
                "original_relationship_schema": "DataCite",
                "original_relationship_name": "Cites",
                "scholix_relationship": "References"
            },
            "relation_provider": {
                "name": "Zenodo"
            },
            "license_url": "https://creativecommons.org/publicdomain/zero/1.0/",
            "target": {
                "identifier": {
                    "id_schema": "DOI",
                    "id_url": "https://doi.org",
                    "id": "10.5072/zenodo.53155"
                }
            },
            "source": {
                "publisher": {
                    "name": "Zenodo"
                },
                "identifier": {
                    "id_schema": "DOI",
                    "id_url": "https://doi.org",
                    "id": "10.5072/zenodo.11"
                },
                "type": {
                    "name": "literature",
                    "sub_type_schema": "https://zenodo.org/schemas/records/record-v1.0.0.json#/resource_type/subtype",
                    "sub_type": "publication-article"
                },
                "publication_date": "2017-10-12"
            }
        }
]
}
